{
  "schemaVersion": 1,
  "contractId": "0x49b4d1e81ceec50d64f53dea0ad2bd3f60af46e3f324265e666a1b4ea9d35c74",
  "jobId": "0xdead000000000000000000000000000000000000000000000000000000000001",
  "claimant": "0x000000000000000000000000000000000000c1a1",
  "amount": "900000000",
  "evidenceCid": "QmRecoursePostgresClaim00000000000000000000001",
  "effectReceiptHash": "0xce70bfd7b1c86e94a3f4974193570a51115155a5f9b4f902f03e2fad5932ceff",
  "recoveryReceiptHash": "0xcc1b60bd7687265fa692cf1ceb6a2a00758e2e8123923e195137c11889635c86",
  "routeHint": "optimistic",
  "signature": "0x0000000000000000000000000000000000000000000000000000000000000000000000000000000000000000000000000000000000000000000000000000000000"
}
